Producto,Precio,Cant de Reviews
Procesador gamer Intel Core i5 10400F BX8070110400F de 6 núcleos y 4.3GHz de frecuencia,22.899,147
Pc Armada Cpu Amd Full Gamer A10-9700 16gb Ddr4 2400mhz 1080p Hdmi,84.999,44
Procesador AMD Ryzen 5 5600X 100-100000065BOX de 6 núcleos y 4.6GHz de frecuencia,39.299,374
Procesador gamer AMD Ryzen 5 3600 100-100000031BOX de 6 núcleos y 4.2GHz de frecuencia,37.499,30
Combo Mineria Intel Celeron G4930 + Z390-p + 8gb + 6 Risers,87.599,85
Procesador Intel Core i7-10700 BX8070110700 de 8 núcleos y 4.8GHz de frecuencia con gráfica integrada,41.998,47
"MacBook Air A1466 silver 13.3"", Intel Core i5 5350U  8GB de RAM 128GB SSD, Intel HD Graphics 6000 1440x900px macOS Sierra 10",154.999,50
Procesador gamer AMD Ryzen 5 1600 YD1600BBAFBOX de 6 núcleos y 3.6GHz de frecuencia,24.600,186
Procesador gamer Intel Core i7 10700K BX8070110700K de 8 núcleos y 5.1GHz de frecuencia con gráfica integrada,49.899,12
Computadora Cpu Pc Solarmax Intel Core I7 9700 32gb 480g Ssd,110.290,67
Combo Mineria Intel Celeron G4930 + Mother Z390-p + 8gb,76.199,592
Combo Kit Actualizacion Mother E6010n + Micro Amd + 2 Gb Ram,9.999,8
Procesador gamer AMD Ryzen 7 3700X 100-100000071BOX de 8 núcleos y 4.4GHz de frecuencia,50.788,39
Procesador AMD Ryzen 7 5800X 100-100000063WOF de 8 núcleos y 4.7GHz de frecuencia,59.099,171
"Notebook Noblex N14W21 plateada 14.1"", Intel Celeron N3350  4GB de RAM 500GB HDD, Intel HD Graphics 500 1366x768px Windows 10 Home",47.300,5
Procesador gamer Intel Core i9 10900 BX8070110900 de 10 núcleos y 5.2GHz de frecuencia con gráfica integrada,58.599,4
Combo Actualizacion Pc Intel I7 9700 16gb B365 M Aorus Elite,72.999,12
Procesador gamer AMD Ryzen 5 3400G YD3400C5FHBOX de 4 núcleos y 4.2GHz de frecuencia con gráfica integrada,54.800,24
Combo Mineria Intel Celeron G4930 + Mother Z390-p C/6 Slots,69.299,34
Procesador gamer Intel Core i5 10600K BX8070110600K de 6 núcleos y 4.8GHz de frecuencia con gráfica integrada,33.099,41
